{
  "event_id": "0192a6b4-1c2d-7e3f-8a4b-5c6d7e8f9a03",
  "schema_version": "1.0",
  "package_id": "PKG-A1B2C3D4E5F6",
  "event_type": "EXCEPTION",
  "event_time": "2026-10-20T06:10:00Z",
  "emitted_at": "2026-10-20T06:10:01Z",
  "source": { "system": "DC_SCANNER", "device_id": "scanner-YUL01-02", "sequence": 90112 },
  "facility_id": "DC-YUL01",
  "details": { "exception_code": "DAMAGED_LABEL" }
}
